{
  "schemaVersion": "1.0",
  "checkpointId": "cp_01J9K4",
  "template": {
    "ref": "template:support/release-candidate",
    "version": "3"
  },
  "subject": {
    "ref": "agent:support/support-triage",
    "version": "git:3f2a1c",
    "image": "sha256:9d9d9d9d9d9d9d9d9d9d9d9d9d9d9d9d9d9d9d9d9d9d9d9d9d9d9d9d9d9d9d9d",
    "deployment": "deployment:support/support-triage@prod-eu",
    "resolvedFrom": "latest",
    "resolvedAt": "2026-10-02T13:58:00Z"
  },
  "lanes": [
    {
      "lane": "security",
      "rule": {
        "kind": "severity",
        "max": "low"
      },
      "requirements": [
        "REQ-15"
      ],
      "runs": [
        {
          "runId": "R-921",
          "runHash": "bbbbbbbbbbbbbbbbbbbbbbbbbbbbbbbbbbbbbbbbbbbbbbbbbbbbbbbbbbbbbbbb",
          "origin": "adopted:ci"
        },
        {
          "runId": "R-930",
          "runHash": "cccccccccccccccccccccccccccccccccccccccccccccccccccccccccccccccc",
          "origin": "launched"
        }
      ],
      "blocking": true,
      "freshness": "PT"
    }
  ],
  "budget": {
    "approvedUsd": 10.0,
    "spentUsd": 6.4,
    "approvedBy": {
      "identity": "oidc:https://login.example.com/u-7f3a",
      "assurance": "self-attested"
    }
  },
  "state": "planned",
  "outcome": null
}
