{
  "schemaVersion": "1.0",
  "checkpointId": "cp_e4520183d3d3",
  "subject": {
    "ref": "agent:shop/assistant",
    "version": "v7"
  },
  "lanes": [
    {
      "lane": "severity-1-0-run",
      "rule": {
        "kind": "severity",
        "max": "none"
      },
      "runs": [
        {
          "runId": "S-1-0-with-a-1-1-line",
          "runHash": "5669cb5c84d70ac2b6070518cc4224a42011e4315870765a29ba486d6506b3c4",
          "origin": "launched"
        }
      ],
      "blocking": true
    }
  ],
  "state": "decided",
  "outcome": "approved",
  "decisionInput": {
    "subjectVersion": "v7",
    "evaluatedAt": "2026-10-08T00:00:00Z",
    "supersededBy": null,
    "lanes": [
      {
        "lane": "severity-1-0-run",
        "blocking": true,
        "result": {
          "status": "passed",
          "subjectVersion": "v7",
          "oldestClosedAt": "2026-10-03T00:00:00Z"
        },
        "evidence": [
          "5669cb5c84d70ac2b6070518cc4224a42011e4315870765a29ba486d6506b3c4"
        ]
      }
    ]
  },
  "decision": {
    "outcome": "approved",
    "lanes": [
      {
        "lane": "severity-1-0-run",
        "status": "passed",
        "blocking": true
      }
    ],
    "reasons": [
      "outcome:approved"
    ]
  }
}
